{
  "schema": "corridor_audit_v1",
  "created_at": "2027-01-01T00:00:00Z",
  "caution": "Bounded advisory only; no path closure, no governance transfer, no canonical settlement.",
  "decision": "pass",
  "findings": [
    {
      "targetId": "target:delta",
      "severity": "info",
      "type": "corridor-emerging",
      "message": "Plurality and dissent rising; possible new discovery corridor forming.",
      "advisory": "watch",
      "notes": [
        "monitor emerging threads"
      ]
    },
    {
      "targetId": "target:gamma",
      "severity": "info",
      "type": "corridor-stable",
      "message": "Corridor indicators remain stable; continue bounded watch-state monitoring.",
      "advisory": "watch",
      "notes": [
        "monitor emerging threads"
      ]
    }
  ]
}
